[
  {
    "id": "1914:cast-moltke-helmuth-von-younger",
    "person": "person:moltke-helmuth-von-younger",
    "side": "de",
    "role": "Chief of the German General Staff; ran the campaign from OHL",
    "bio": "Chief of the General Staff since 1906, Moltke inherited the deployment concept Schlieffen left behind and reshaped it: the march through the Netherlands was dropped, Liège was to be seized by a *coup de main* in the first days, and the left wing in Lorraine was strengthened at the expense of the sweeping right.[^mombauer-2001] On 1 August, when the Kaiser briefly hoped to send the army east alone, Moltke told him the deployment could not be reversed — the timetable, not the politics, ruled.[^tuchman-1962]\n\nHe ran the war from far behind the front — Koblenz, then Luxembourg from 30 August — with thin wireless links to the armies, and the decisions that shaped September were his: on 25 August he sent two corps from the right wing to East Prussia; on 4–5 September, too late, he ordered the 1st and 2nd Armies to turn and face Paris; on 8 September he sent Lieutenant-Colonel Hentsch to the armies with authority to order a retreat.[^herwig-2009] He broke under the strain, and on 14 September Falkenhayn took over his duties.[^strachan-2001]\n\nWhether he ruined Schlieffen's plan or inherited something that could never have worked is the central argument of the campaign's historiography.[^zuber-2002][^mombauer-2001]",
    "sources": [
      {
        "source": "source:mombauer-2001"
      },
      {
        "source": "source:herwig-2009"
      },
      {
        "source": "source:tuchman-1962"
      },
      {
        "source": "source:strachan-2001"
      },
      {
        "source": "source:zuber-2002"
      }
    ]
  },
  {
    "id": "1914:cast-schlieffen-alfred-von",
    "person": "person:schlieffen-alfred-von",
    "side": "de",
    "role": "Chief of the General Staff 1891–1906; author of the 1905 memorandum",
    "bio": "Schlieffen had been dead nineteen months when the war began. He is in this story because of a paper: the great memorandum of December 1905, written as he left office, which imagined a war against France won by a massive right wing wheeling through Belgium and northern France, passing west of Paris and pinning the French armies against their own fortress line.[^zuber-2002]\n\nWhat that paper was — an operational plan handed down to his successor, or a staff study and a plea for more divisions — is the sharpest dispute in the literature. Zuber argues there was no 'Schlieffen Plan' and that the legend was built after 1918 by officers who needed a plan that Moltke had spoiled; Mombauer, Holmes and Foley answer that Moltke inherited a real concept and altered it.[^zuber-2002][^mombauer-2001] The pack's hypothetical branch, 'Schlieffen's concept', draws the memorandum's sweep beside what actually happened, and Herwig's question — could the outer wheel ever have been marched and supplied — hangs over both.[^herwig-2009]",
    "sources": [
      {
        "source": "source:zuber-2002"
      },
      {
        "source": "source:mombauer-2001"
      },
      {
        "source": "source:herwig-2009"
      }
    ]
  },
  {
    "id": "1914:cast-kluck-alexander-von",
    "person": "person:kluck-alexander-von",
    "side": "de",
    "role": "Commander, German 1st Army — the outer edge of the wheel",
    "bio": "Kluck commanded the army on the extreme right, the one with the farthest to march. It met the British at Mons on 23 August and at Le Cateau on 26 August, then pressed south-west after them.[^edmonds-1922][^herwig-2009] Subordinated to Bülow's 2nd Army for ten days, he chafed at every order to close in.[^herwig-2009]\n\nOn 30–31 August, answering Bülow's call for help after Guise and hoping to roll up the French left, Kluck turned his army south-east — inside Paris rather than around it. He crossed the Marne on 3 September with his flank open to the capital; the new French 6th Army found that flank on 5 September.[^tuchman-1962][^herwig-2009] Kluck swung corps after corps back north to fight on the Ourcq, and won that fight, but the move opened a forty-kilometre gap between his army and Bülow's into which the British and the French 5th Army walked.[^herwig-2009] On 9 September he was ordered back to the Aisne.[^strachan-2001]",
    "sources": [
      {
        "source": "source:herwig-2009"
      },
      {
        "source": "source:tuchman-1962"
      },
      {
        "source": "source:edmonds-1922"
      },
      {
        "source": "source:strachan-2001"
      }
    ]
  },
  {
    "id": "1914:cast-bulow-karl-von",
    "person": "person:bulow-karl-von",
    "side": "de",
    "role": "Commander, German 2nd Army; Kluck's neighbour and, briefly, his superior",
    "bio": "Bülow's 2nd Army took Namur and forced the Sambre at Charleroi on 21–23 August against Lanrezac's 5th Army, then absorbed Lanrezac's counterstroke at Guise on 29 August — the blow that made him ask Kluck to wheel inward to his support.[^herwig-2009][^strachan-2001] For ten days in August Kluck was placed under his orders, an arrangement that pleased neither man.[^herwig-2009]\n\nAt the Marne his right wing fell back behind the Petit Morin as Kluck's corps marched away north to the Ourcq, and the gap between the two armies grew. On the evening of 8 September, with Hentsch at his headquarters, he judged the 2nd Army's position untenable; on 9 September he ordered its retreat, and the 1st Army's followed.[^herwig-2009][^tuchman-1962] Whether his caution lost a battle the Germans were winning is still argued; the official history blamed him more than it blamed Moltke.[^herwig-2009]",
    "sources": [
      {
        "source": "source:herwig-2009"
      },
      {
        "source": "source:strachan-2001"
      },
      {
        "source": "source:tuchman-1962"
      }
    ]
  },
  {
    "id": "1914:cast-hausen-max-von",
    "person": "person:hausen-max-von",
    "side": "de",
    "role": "Commander, German 3rd (Saxon) Army",
    "bio": "Hausen's Saxon army marched between Bülow and the Crown Prince, forcing the Meuse at Dinant on 23 August — where the army shot 674 civilians in the worst of the August killings in Belgium.[^horne-kramer-2001][^herwig-2009] At the Marne it stood opposite Foch's new 9th Army at the marshes of Saint-Gond; in the small hours of 8 September Hausen sent his Saxons forward in a bayonet attack without artillery preparation around Fère-Champenoise and drove Foch's right back several kilometres, the last German success of the battle.[^herwig-2009] It could not be exploited: the retreat order reached him on 9 September, and he himself was ill with typhus and relieved of command on 12 September.[^herwig-2009][^strachan-2001]",
    "sources": [
      {
        "source": "source:herwig-2009"
      },
      {
        "source": "source:horne-kramer-2001"
      },
      {
        "source": "source:strachan-2001"
      }
    ]
  },
  {
    "id": "1914:cast-rupprecht-of-bavaria",
    "person": "person:rupprecht-of-bavaria",
    "side": "de",
    "role": "Commander, German 6th Army in Lorraine — the left wing",
    "bio": "Rupprecht, heir to the Bavarian throne, commanded the left wing that Plan XVII attacked. When the French 1st and 2nd Armies advanced into Lorraine on 14 August his orders were to give ground and draw them in; with his chief of staff Krafft von Dellmensingen he pressed OHL for permission to counter-attack instead, got it, and struck at Morhange–Sarrebourg on 20 August, throwing the French back to the Meurthe.[^herwig-2009][^strachan-2001]\n\nHe then tried to break through the Trouée de Charmes and, from 4 to 12 September, to take the Grand Couronné in front of Nancy, and failed.[^herwig-2009] Whether the left wing should have kept yielding — the 'revolving door' that would have swung the French away from the decisive right — is one of the oldest criticisms of the German conduct of the campaign.[^keegan-1998][^strachan-2001]",
    "sources": [
      {
        "source": "source:herwig-2009"
      },
      {
        "source": "source:strachan-2001"
      },
      {
        "source": "source:keegan-1998"
      }
    ]
  },
  {
    "id": "1914:cast-hentsch-richard",
    "person": "person:hentsch-richard",
    "side": "de",
    "role": "Head of intelligence at OHL; Moltke's emissary to the armies, 8–9 September",
    "bio": "A lieutenant-colonel of the General Staff, Hentsch was sent by Moltke on 8 September to drive from Luxembourg to the headquarters of the five armies on the right wing and the centre, with authority — its exact extent is disputed — to coordinate a withdrawal if the gap between the 1st and 2nd Armies could not be closed.[^herwig-2009][^tuchman-1962] He found Bülow that evening already inclined to retreat; on the morning of 9 September, at Kluck's headquarters at Mareuil, he ordered the 1st Army back towards the Aisne, and the battle of the Marne ended.[^herwig-2009]\n\nA staff officer had turned back the German right wing. The army inquired into it in 1917 and found he had acted within his orders; the argument over whether he, Bülow or Moltke lost the Marne has never closed.[^herwig-2009][^strachan-2001]",
    "sources": [
      {
        "source": "source:herwig-2009"
      },
      {
        "source": "source:tuchman-1962"
      },
      {
        "source": "source:strachan-2001"
      }
    ]
  },
  {
    "id": "1914:cast-ludendorff-erich",
    "person": "person:ludendorff-erich",
    "side": "de",
    "role": "Deputy chief of staff, 2nd Army; the man who took Liège",